,speaker,text
0,lex fridman, the following is a conversation with lisa randall a theoretical physicist and cosmologist at harvard her work involves improving our understanding of particle physics supersymmetry baryogenesis cosmological inflation and dark matter
1,lex fridman, this is the lex friedman podcast to support it please check out our sponsors in the description now dear friends heres lisa randall
2,lex fridman,dark matter
3,lex fridman, one of the things you work on and write about is dark matter we cant see it but theres a lot of it in the universe you also end one of your books with a beatles song quote got to be goodlooking because hes so hard to see what is dark matter how should we think about it given that we cant see it how should we visualize it in our minds eye
4,lisa randall, i think one of the really important things that physics teaches you is just our limitations but also our abilities the fact that we can deduce the existence of something that we dont directly see is really a tribute to people that we can do that its also something that tells you you cant overly rely on your direct senses if you just relied on just what you see directly you would miss so much of whats happening in the world
5,lisa randall, we can generalize this but just for now to focus on dark matter its something we know is there and its not just one way we know its there in my book dark matter and the dinosaurs i talk about the many different ways theres eight or nine that we deduce not just the existence of dark matter but how much is there and they all agree
6,lisa randall, now how do we know its there because of its gravitational force individually a particle doesnt have such a big gravitational force in fact gravity is an extremely weak force compared to other forces we know about in nature but theres a lot of dark matter out there it carries a lot of energy five times the amount of energy as the matter we know thats in atoms et cetera
7,lisa randall, you can ask how should we think about it its just another form of matter that doesnt interact with light or at least as far as we know it interacts gravitationally it clumps it forms galaxies but it doesnt interact with light which means we just dont see it most of our detection before gravitational wave detectors we only saw things because of their interactions with light in some sense
8,lex fridman, in theory it behaves just like any other matter it just doesnt interact with light
9,lisa randall, when we say it interacts just like any other form of matter we have to be careful because gravitationally it interacts like other forms of matter but it doesnt experience electromagnetism which is why it has a different distribution
10,lisa randall, in our galaxy its roughly spherical unless it has its own interactions thats another story we know that its roughly spherical whereas ordinary matter can radiate and clumps into a disk thats why we see the milky way disk on large scales in some sense yes all the matter is similar in some sense
11,lisa randall, in fact dark matter is in some sense more important because it can collapse more readily than ordinary matter because ordinary matter has radiative forces which makes it hard to collapse on small scales actually its dark matter that drives galaxy formation and then ordinary matter comes along with it
12,lisa randall, theres also just more of it and because theres more of it can start collapsing sooner that is to say the energy density in dark matter dominates over radiation earlier than you would if you just had an ordinary matter
13,lex fridman, its part of the story of the origin of the galaxy part of the story of the end of the galaxy and part of the story of all the various interactions throughout
14,lisa randall, exactly in my book i make jokes about its like when we think about a building we think about the architect we think about the high level but we forget about all the workers that did all the grunt work in fact dark matter was really important in the formation of our universe and we forget that sometimes
15,lex fridman, thats a metaphor on top of a metaphor okay the unheard voices that do the actual work
16,lisa randall, exactly no but it is a metaphor but it also captures something because the fact is we dont directly see it so we forget its there or we dont understand its there or we think its not the fact that we dont see it makes it no less legitimate it just means that we have challenges in order to find out exactly what it is
17,lex fridman, yeah but the things we cannot see that nevertheless have a gravitational interaction with the things we cant see is at the layman level its just mindblowing
18,lisa randall, it is and it isnt because i think what its teaching us is that were human the universe is what it is and were trying to interact with that universe and discover what it is weve discovered amazing things
19,lisa randall, in fact i would say its more surprising that the matter that we know about is constitutes as big a fraction of the universe as it does were limited were human the fact that we see  of the energy density of the universe about one sixth of the energy density in matter thats remarkable why should that be anything could be out there yet the universe that we see is a significant fraction
20,lex fridman, yeah but a lot of our intuition i think operates using visualizations in the mind
21,lisa randall, thats absolutely true certainly writing books i realized also how many of our words are based on how we see the world and thats true thats actually one of the fantastic things about physics is that it teaches you how to go beyond your immediate intuition to develop intuitions that apply at different distances different scales different ways of thinking about things
22,lex fridman, yeah how do you anthropomorphize dark matter
23,lisa randall, i just did i think i made it the grunt workers
24,lex fridman, oh yeah thats good you did thats why you get paid the big bucks and write the great books okay you also write in that book about dark matter having to do something with the extinction events the extinction of the dinosaurs which is a fascinating presentation of how everything is connected
25,lex fridman, i guess the disturbances from the dark matter they create gravitational disturbances in the oort cloud at the edge of our solar system and then that increases the rate of asteroids hitting earth
26,lisa randall, i want to be really clear this was a speculative theory
27,lex fridman, i love it though
28,lisa randall, i liked it too we still dont know for sure but what we liked about it let me take a step back we usually assume that dark matter we being physicists that its just one thing its just basically noninteracting aside from gravity or very weakly interacting matter
29,lisa randall, again we have to get outside this mindset of just humans and ask what else could be there what we suggested is that theres a fraction of dark matter not all the dark matter but some of the dark matter maybe it has interactions of its own just the same way in our universe we have lots of different types of matter we have nuclei we have electrons we have neutrons we have forces
30,lisa randall, its not a simple model the standard model but it does have some basic ingredients so maybe dark matter also has some interesting structure to it maybe theres some small fraction the interesting thing is that if some of the dark matter does radiate and i like to call it dark light because its light that we dont see but dark matter would see it could radiate that and then it could perhaps collapse into a disk the same way ordinary matter collapsed into the milky way disk
31,lisa randall, its not all the dark matter its a fraction but it could conceivably be a very thin disk of dark matter thin dense disk of dark matter the question is do these exist people have done studies now to think about whether they can find them its an interesting target its something you can measure by measuring the positions and velocities of stars you can find out what the structure of the milky way is but the fun proposal was that the solar system orbits around the galaxy
32,lisa randall, as it does so it goes a little bit up and down kind of horses on a carousel the suggestion was every time it goes through you have an enhanced probability that you would dislodge something from the edge of the solar system in something called the oort cloud the idea was that at those times youre more likely to have these cataclysmic events such as the amazing one that actually caused the last extinction that we know of for sure
33,lex fridman, it wasnt so amazing for the dinosaurs
34,lisa randall, or for two thirds of the species on the planet
35,lex fridman, but it gets amazing for humans it wouldnt be
36,lisa randall, what really is amazing i talk about this in dark matter and the dinosaurs it is just an amazing scientific story because it really is one of the real stories that combine together different fields of science geologists at the time or people thought that things happen slowly and this would be a cataclysmic event
37,lisa randall, also i have to say if you think about it it sounds like a story a fiveyearold would make up maybe the dinosaurs were killed by some big rock that came and hit the earth but then there really was a scientific story behind it thats also why i like the dark disk because theres a scientific story behind it as farfetched as it might sound you could actually go and look for the experimental consequences for the observational consequences to test whether its true
38,lex fridman, i wish you could know highresolution details of where that asteroid came from where in the oort cloud why it happened is it in fact because of dark matter just the full tracing back to the origin of the universe because humans seem to be somewhat special it seems like so many fascinating events at all scales of physics had to happen for inaudible 
39,lisa randall, im really really glad you mentioned that because actually that was one of the main points of my book dark matter and the dinosaurs one of the reasons i wrote it was because i really think we are abusing the planet were changing the planet way too quickly just like anything else when you alter things its good to think about the history of what it took to get here
40,lisa randall, as you point out it took many operations on many different scales we had to have the formation of structure the formation of galaxies the formation of the solar system the formation of our planet the formation of humans theres so many steps that go into this humans in some part were the result of the fact that this big object hit the earth made the dinosaurs go extinct and mammals developed it is an incredible story and yes something else might come of it but it wont be us if we mess with it too much
41,lex fridman, but it is on a grand scale earth is a pretty resilient system can you just clarify just fascinating the shape of things the shape of the milky ways of the observable stuff is mostly flat you said dark matter tends to be spherical but a subset of that might be a flat disk
42,lisa randall, you want to hear about the shape of things
43,lex fridman, yes please
44,lisa randall, structure formed early on and now our structure that we live in is we know about the milky way galaxy the milky way galaxy has the disk you can see in a dry dark place thats where stars and light is but you can also measure in some ways the dark matter we believe that dark matter is more or less spherically distributed like we said theres a lot of it not necessarily in the disk but just because its a sphere theres a lot of it sitting there
45,lisa randall, the reason it doesnt collapse as far as we know is that it cant radiate the same way because it can radiate ordinary matter collapses and this actually because of conservation of angular momentum it stays a disk and it doesnt just collapse to the center our suggestion was that maybe there are some components of dark matter that also radiate
46,lisa randall, like i said thats far from proven people have looked for a disk they see some evidence of some disks of certain densities but these are all questions that are worth asking basically if we can figure it out from existing measurements why not try
47,lex fridman, okay so not all dark matter is made the same
48,lisa randall, thats a possibility we actually dont know what dark matter is in the first place we dont know what most of it is we dont know what a fraction is its hard to measure why is it hard to measure for exactly the reason you said earlier we dont see it we want to think of possibilities for what it can be especially if those give rise to some observational consequences its a tough game because its not something thats just there for the taking you have to think about what it could be and how you might find it
49,lex fridman, the way you detect it is gravitational effects on things we can see
50,lisa randall, that would be the way you detect the type of dark matter ive been talking about people have suggestions for other forms of dark matter they could be particles called axions they could be other types of particles and then there are different ways of detecting it
51,lisa randall, the most popular candidate for dark matter probably until pretty recently because they havent found it is something called wimps weakly interacting massive particles particles that have mass about the same as the higgs boson mass and it turns out then you would get about the right density of dark matter
52,lisa randall, people really like that of course because it is connected to the standard model the particles that we know about and if its connected to that we have a better chance of actually seeing it fortunately or unfortunately its also a better chance that you can rule it out because you can look for it so far no one has found it were still looking for
53,lex fridman, is that one of the hopes of the large hadron collider
54,lisa randall, that was originally one of the hopes of large hadron collider id say at this point it would be very unlikely given what theyve already accomplished but there are these underground detectors xenon detectors that look for dark matter coming in and they are going to try to achieve a much stronger bound than exists today
55,lex fridman, just to take that tangent looking back now whats the biggest to you insight to humanity that the lhc has been able to provide
56,lisa randall, its interesting its both a major victory the higgs boson was proposed  years ago and it was discovered the higgs mechanism seemed to be the only way to explain elementary particle masses and it was right so on the one hand it was a major victory on the other hand ive been in physics long enough to know it was also a cautionary tale in some sense because at the time i started out in physics we had proposed something in the united states called the superconducting supercollider
57,lisa randall, a lot of physicists ill say particularly in europe but id say a lot of physicists were saying when that the large hadron collider would have the energy reach necessary to discover what underlies the standard model we dont want to just discover the standard model we want to know what the next step is
58,lisa randall, i think here people were more cautious about that they want to have a more comprehensive search that could get to higher energies more events so that we could really more definitively rule it out in that case many people thought they knew what would be there it happened to be a theory called supersymmetry a lot of physicists thought it would be supersymmetry
59,lisa randall, its one of the many factors i think that went into the fact that the large hadron collider became the only machine in town and the superconducting supercollider wouldve just been a much if it had really had achieved what it was supposed to wouldve been a much more robust test of the space
60,lisa randall, id say for humanity its both a tribute to the ability of discovery and the ability of really believing in things so that you have the confidence to go look for them but its also a cautionary tale that you dont want to assume things before theyve been actually found you want to believe in your theories but you also want to question them at the same time in ways that youre more likely to discover the truth
61,lex fridman, its also an illustration of grand engineering efforts that humanity can take on and maybe a lesson that you could go even bigger
62,lisa randall, im really glad you said that though too because thats absolutely true it really is an impressive its impressive in so many ways its impressive technologically its impressive at engineering level
63,lisa randall, its also impressive that so many countries work together to do this it wasnt just one country it was also impressive in that it was a longterm project that people committed to and made it happen it is a demonstration that when people set their minds to things and they commit to it that they can do something amazing
64,lex fridman, also in the united states maybe a lesson that bureaucracy can slow things down to inaudible 
65,lisa randall, bureaucracy and politics
66,lex fridman, politics
67,lisa randall, and economics many things can make them faster and make them slower
68,lex fridman, science is the way to make progress politics is the way to slow that progress down and here we are
69,lisa randall, i dont want to overstate that because without politics the inaudible  wouldnt happen either
70,lex fridman, you need broccoli
71,lisa randall, sometimes i do think youre not asking this question but sometimes i do think when i think about some of these conflicts sometimes its just good to have a project that people work on together there were some efforts to do that in science too to have palestinians and israelis work together a project called sesame i think its not a bad idea when you can do that when you can get forget the politics and just focus on some particular project sometimes that can work
72,lex fridman, some kind of forcing function some kind of deadline that gets people to sit in a room together and youre working on a thing as part of that you realize the common humanity that you all have the same concerns the same hopes the same fears that you are all human thats an accidental side effect of working together on a thing
73,lisa randall, thats absolutely true its one of the reasons cern was formed actually it was postworld war ii and a lot of european physicists had actually left europe and they wanted to see europeans work together and rebuild and it worked they did its true i often think that that one of the major problems is we just dont meet enough people so that everyone when they seem like the other its more easy to forget their humanity i think it is important to have these connections
74,lisa randall,extinction events
75,lex fridman, given the complexity all cosmological scales involved here that led to the extinction of the dinosaurs when you look out at the future of earth do you worry about future extinction events
76,lisa randall, i do think that we might be in the middle of an extinction right now if you define it by the number of species that are getting killed off its subtle but its a complex system the way things respond to events is sometimes things evolve sometimes animals just move to another place the way weve developed the earth its very hard for species just to move somewhere else
77,lisa randall, were seeing that with people now too i know people are worried just about ai taking over and thats a totally different story we just dont think about the future very much we think about what were doing now and we certainly dont think enough about all the animals that were destroying all the things that are precursors to humans that we rely on
78,lex fridman, its interesting to think whether the things that threaten us is the stuff we see thats happening gradually or the stuff we dont really see thats going to happen all of a sudden i sometimes think about what should we be worried about it seems like with the asteroids or nuclear war it could be stuff that just happens one day when i say one day meaning over a span of a few days or a few months but not on a scale of decades and centuries we sometimes mostly talk about stuff thats happening gradually but we can be really surprised
79,lisa randall, its actually really interesting that was actually one of the reasons it took a while to determine what it was that it caused the last extinction because people did think at the time many people thought that things were more gradual and the idea of extinction was actually a novel concept at some point
80,lisa randall, these arent predictable events necessarily theyre only predictable on a grand scale but sometimes they are i think people were pretty aware that nuclear weapons were dangerous im not sure people are as aware now as they were say  or  years ago and that certainly worries me i have to say i was not as worried about ai as other people but now i understand its more that as soon as you create things that we lose control over its scary
81,lisa randall, the other thing that were learning from the events today is that it takes a few bad actors it takes everyone to make things work well it takes not that many things to make things go wrong the issue with disease we can find out what causes a disease but to make things better is not necessarily that simple sometimes it is but for things to be healthy a lot of things have to work for things to go wrong only one thing has to go wrong its amazing that we do it
82,lisa randall, the same is true for democracy for democracy to work a lot of people have to believe in it a few bad actors can destroy things sometimes a lot of the things that we really rely on are delicate equilibrium situations there is some robustness in the systems we try to build in robustness but a few extreme events can sometimes alter things i think thats what people are scared of today in many ways theyre scared of it for democracy theyre scared of it for peace theyre scared of it for ai
83,lisa randall, i think theyre not as scared as they should be about nuclear weapons to be honest i think thats more serious danger than people realize i think people are a little bit more scared about pandemics than they were before but i still say theyre not super scared about it so youre right there are these major events that can happen and we are setting things up so that they might happen and we should be thinking about them the question is who should be thinking about them how should we be thinking about them how do you make things happen on a global scale because thats really what we need
84,lex fridman, it certainly shouldnt be a source of division it should be a source of grand collaboration probably
85,lisa randall, wouldnt that be nice
86,lex fridman, yeah i just wonder what itd be like to be a dinosaur it must have been beautiful to look at that asteroid enter the atmosphere until everything man that would be one of the things i would travel back in time to just to watch it
87,lisa randall, thats also one of the things that i think you probably could do with virtual reality i dont think you have to be there and get extinct
88,lex fridman, to just experience it
89,lisa randall, i think theres something its an event youre just watching youre not doing anything youre just looking at it so maybe you could just recreate it
90,lex fridman, i actually heard that theres a nuclear weapon explosion experience in virtual reality thats good to remind you about what it would feel like
91,lisa randall, i have to say i got an award from the museum of nuclear history and technology in the southwest and i went to visit the museum which turned out to be mostly a museum of nuclear weapons the scary thing is that they look really cool
92,lisa randall, its true that you have that yes this is scary but you also have this is cool feeling and i think we have to get around that because i think that yes you can be in that but im not sure thats going to make people scared have they actually asked afterwards are you more or less scared
93,lex fridman, thats a really good point thats a good summary of just humanity in general were attracted to creating cool stuff even though it can be dangerous
94,lisa randall, actually that was the really interesting thing about visiting that museum actually it was very nice because i had a tour from people who had been working there in the cold war and actually one or two people from the manhattan project it was a very cool tour you just realize just how just the thing itself gets you so excited
95,lisa randall, i think thats something sometimes these movies miss just the thing itself youre not thinking about the overall consequences in some ways it was like the early silicon valley people were just thinking what if we did this what if we did that not keeping track of what the peripheral consequences are you definitely see that happening with ai now i think that was the moral of the battle that just happened that its just full speed ahead
96,lex fridman, which gives me a really great transition to another quote in your book you write about the experience of facing the sublime in physics and you quote rainer rilke for beauty is nothing but the beginning of terror which we are still just able to endure and were so odd because its serenely disdains to annihilate us its pretty intense it i think applies to nuclear weapons
