,speaker,text
97,lisa randall, at a more mundane perhaps level i think it applies its really interesting one of the things that i found when i wrote these books is some people love certainty scientists many revel in uncertainty its not that you want to be uncertain you want to solve it but youre at this edge where its really frustrating because you dont really want to not know the answer but of course if you knew the answer it would be done
98,lisa randall, youre always at this edge where youre trying to sort things out and there is something scary you dont know if theres going to be a solution you dont know if youre going to find it its not something that can destroy the earth its just something that you do on your individual level but then of course there are much bigger things like the ones youre talking about where they could actually be dangerous the stuff i do i just want to be clear im doing theoretical physics not very dangerous but sometimes things end up having bigger consequences than you think
99,lex fridman, dangerous in a very pragmatic sense isnt it still in part terrifying when you think of just the size of things like the size of dark matter the power of this thing in terms of its potential gravitational effects just cosmological objects of a black hole at the center of our galaxy
100,lisa randall, this might be why im a physicist or why i differ from other people because im not such a big fan of humanity in some ways some ways i am but the idea that we were everything would be really boring to me i love the idea that theres so much more out there that theres a bigger universe and theres lots to discover and that were not all there is wouldnt it be disappointing if we were all there is
101,lex fridman, yeah and the full diversity of other stuff is pretty interesting
102,lisa randall, we have no idea how much there is we know what we can observe so far so the idea that theres other stuff out there that we yet have to figure out its exciting
103,lex fridman, let me ask you an out there question if you think of humans on earth life on earth as this pocket of complexity that emerged and theres a bunch of conditions that came to be and theres darwinian evolution and however life originated do you think its possible theres some pockets of complexity of that sort inside dark matter that we cant see
104,lisa randall, thats possible
105,lex fridman, chemistry and biology evolving in different ways
106,lisa randall, thats one of the reasons we suggest its not the reason but it would be true if there were the type of interactions wed suggest it would need more complex ones we dont know i will say that the conditions that give rise to life and complexity theyre complex theyre unlikely its not like theres great odds that would happen but theres no reason to know that it doesnt happen its worth investigating are there other forces that exist in the dark matter sector thats exactly
107,lex fridman, so the dark matter sector doesnt have all the forces of the standard model of physics
108,lisa randall, right as far as we know it doesnt have any it might have it at some low level but it could have its own forces just like the dark matter might not experience our light maybe it has its light that we dont experience
109,lex fridman, so there could be other kinds of forces
110,lisa randall, there could be other kinds of forces even within our sector that are too weak for us to have discovered so far or that exist at different scales than we know about we detect what interacts strongly enough with our detectors to detect its worth asking and thats one of the reasons we build big colliders to see are there other forces other particles that exist say at higher energies at shorter distance scales than weve explored so far its not just in the dark matter sector even in our sector there could be a whole bunch of stuff we dont yet know
111,lisa randall,particle physics
112,lex fridman, maybe lets zoom out and look at the standard model of particle physics how does dark matter fit into it first of all what is it can you explain what the standard model is
113,lisa randall, the standard model of particle physics is basically it tells us about natures most basic elements and their interactions its the substructure as far as we understand it if you look at atoms we know they have nuclei and electrons nuclei have protons and neutrons in them protons and neutrons have particles called quarks that are held together by something called the strong force
114,lisa randall, they interact through the strong force the strong nuclear force theres something called the weak nuclear force and electromagnetism basically all those particles and their interactions describe many many things we understand thats the standard model we now know about the higgs boson which is associated with how elementary particles get their mass that piece of the puzzle has also been completed
115,lisa randall, we also know that there are a weird array of masses of elementary particles theres not just the up and down quark but there are heavier versions of the up and down quark charm and strange top and bottom theres not just the electron theres a muon and a tau there are particles called neutrinos which are under intense study now which are partnered with the leptons through the weak interactions
116,lisa randall, we really do know these basic elements and we know the forces when were doing particle physics experiments we can usually even ignore gravity except in exceptional cases that we can talk about those are the basic elements in their interactions
117,lisa randall, dark matter stands outside that its not interacting through those forces when we look at the world around us we dont usually see the effects of dark matter its because theres so much of it that we do and it doesnt have those forces that we know about the standard model has worked spectacularly well its been tested to a high degree of precision people are still testing it
118,lisa randall, one of the things we do as physicists is we actually want it to break down at some level were looking for the precision measurement or the energy or whatever it will take where the standard model is no longer working not that its not working approximately but were looking for the deviations those deviations are critical because they can tell us what underlies the standard model which is what we really want to see next
119,lex fridman, where can you find the places where the standard model breaks down what are the places you can see those tiny little deviations
120,lisa randall, we dont know yet but we know the kinds of things you wouldnt want to look for one obvious place to look is at higher energy were looking at the large hadron collider but wed love to go beyond that higher energy means shorter distances and it means things that we just couldnt produce before emc so if you have a heavy particle and you dont have enough energy to make it youll never see it thats one place
121,lisa randall, the other place is precision measurements the standard model has been tested exquisitely so if its been tested  you want to look at a th of a percent there are some processes that we know shouldnt even happen at all in the standard model or happen at very suppressed level and those are other things that we look for all of those things could indicate theres something beyond what we know about which of course would be very exciting
122,lex fridman, when you just step back and look at the standard model the quarks and all the different particles and neutrinos isnt it wild how this little system came to be and underpins everything we see
123,lisa randall, absolutely thats why wed like to understand it better we want to know is it part of some bigger sector why are these particles why do they have the masses they do why is the higgs boson so light compared to the mass that could have had which we mightve even expected based on the principles of special relativity and quantum mechanics thats a really big question why are they what they are
124,lex fridman, and they originate theres some mechanism that created the whole thing
125,lisa randall, thats one of the things were trying to study why is it what it is
126,lex fridman, even just the mechanism that creates stuff the way a human being is created from a single cell its like embryogenesis the whole thing you build up this thing all of it this whole thing comes to be from just like a inaudible 
127,lisa randall, dont forget it is interacting with the environment
128,lex fridman, for sure okay right right right
129,lisa randall, its important
130,lex fridman, thats a really good question is how much of it is the environment is it just the environment acting on a set of constraints how much of it is just the information in the dna or any information how much is it in the initial conditions of the universe versus some other thing acting on it
131,lisa randall, these are big questions these are big questions in pretty much every field for the universe we do consider it its everything there is by definition but people now think about it is it one of many universes of course its a misnomer but could there be other places where there are selfcontained gravitational systems that we dont even interact with those are really important questions and the only way were going to answer them is we go back as far as we can we try to think theoretically and we try to think about observational consequences thats all we can do
132,lex fridman, one interesting way to explore the standard model is to look at your fun nuanced disagreement with carlo rovelli when you talked about him writing in his book electrons dont always exist they exist when they interact they materialize in a place when they collide with something else you wrote that ill just read the whole thing because its interesting
133,lex fridman, stocks may not achieve a precise value until theyre traded but that doesnt mean we cant approximate their worth until they change hands similarly electrons might not have definite properties but they do exist its true that the electron doesnt exist as a classical object with definite position until the position is measured but something was there  which physicists use a wave function to describe its a fascinating nuanced disagreement do electrons always exist or not does a tree fall in the forest if nobodys there to see it
134,lisa randall, i like to think of the universe as being out there whether or not it would be really weird if the only time things came into existence was when i saw them or i measured them
135,lex fridman, theres a lot of weird stuff in the works
136,lisa randall, i could believe that the middle east doesnt exist because im not there now that would be kind of ridiculous i think we would all agree on that i think theres only so much that we can attribute to our own powers of seeing the whole system doesnt come into being because im measuring it what is weird and this isnt even a disagreement about the standard model this is a disagreement about how you interpret quantum mechanics
137,lisa randall, i would say that those wave functions are real one of the things that dont forget that particle physics does that quantum field theory says is that electrons can be created and destroyed its not that every electron has to be in the universe thats what happens at colliders particles get created and destroyed but that doesnt mean that if i have electron in an atom its not there its certainly there and we know about it its charge is there
138,lex fridman, physics is a kind of way to see the world at the bottom whats the bottom turtle do you have a sense that theres a bottom reality that were trying to approximate with physics
139,lisa randall, i think we always have in our head maybe that wed like to find that but i have to i might not seem so but i think im more humble than a lot of physicists im not sure that were ever going to get to that bottom level but i do think were going to keep penetrating different layers and get further
140,lex fridman, i just wonder how far away we are
141,lisa randall, we all wonder that whats even the measure of how far away we are one way you can measure it is just by our everyday lives in terms of our everyday lives weve measured everything in terms of what underlies it theres a lot more to see part of it has to do with how far we think we can go it might be that the nature of reality changes so much that even these terms are different maybe the notion of distance itself might break down at some point
142,lex fridman, also to push back on the weve measured everything maybe theres stuff we havent even considered is measurable for example consciousness there might be stuff just like you said forces unseen undetected
143,lisa randall, its an interesting thing and this is often a confusion that happens theres the fundamental stuff underlying it and then theres the higher levels what well call an effective theory at some level were not always working when i throw a ball i dont tell you where every atom is i tell you theres a ball
144,lisa randall, there might be different layers of reality that are built in terms of the matter that we know about in terms of the stuff we know about that when i say weve measured everything i say that with a grain of salt i mean weve measured everything about the standard model theres lots of phenomena that we dont understand but often there are complex phenomena that will be given in terms of the fundamental ingredients that we know about
145,lex fridman, that is an interesting question because yes theres phenomena that are at the higher level of abstractions that emerge but maybe with consciousness there is far out people that think that consciousness is panpsychus that theres going to be almost like a fundamental force of physics thats consciousness that permeates all that matter
146,lisa randall, usually when you have a crazy sorry when you have a far out theory the thing you do is you test all the possibilities within the constructs that exist you dont just jump to the most far out possibility you can do that but then to see if its true you either have to find evidence of it or you have to show that its not possible without that and were very far from that
147,lex fridman, i think one of the criticisms of your theory on the dinosaurs was that it requires if i remember correctly for dark matter to be weirder than it already is i think you had a clever response to that can you remind
148,lisa randall, im not sure i remember what i said then but we have no idea how weird dark matter is its based on everyone thinking they know what dark matter is weirder than it already is its not already anything we dont know what it is so theres no normalization here
149,lex fridman, do we know if dark matter varies in density
150,lisa randall, it just certainly does in the universe just like for example theres more dark matter in galaxies than theres between galaxies it clumps its matter so its distributed like matter it is matter
151,lex fridman, it does clump but the full details of how it clumps and the complexity of the clumping
152,lisa randall, its understood pretty well people do simulations where people are always looking for things including us as particle physics its at small scales are the deviations on small scales so that indicating other interactions or other processes or interactions with baryons that is to say normal matter that we dont understand but on large scales we have a pretty good understanding of dark matter distribution
153,lex fridman, you were part of a recent debate on can science uncover reality let me ask you this question then what do you think is the limits of science
154,lisa randall, im smart enough to know that i have no idea also its not even clear what science means because theres the science that we do which is particle physics we try to find fundamental things and figure out what their effects are theres science like biology where at a higher level the kind of questions you ask are different the kind of measurements are different
155,lisa randall, the kind of science thats going to happen in the more numerical age or even ai what does it mean to answer a question does it mean that we can predict it does it mean that we can reproduce it i think were coming up against the definition of what we mean by science as human beings in terms of the science that we can do i dont think well know it until we get there were trying to solve hard problems and weve made progress
156,lisa randall, if you think of how much science has advanced in the last century or century and a half its incredible we didnt even know the universe was expanding at the beginning of the th century we didnt know about quantum mechanics at the beginning of the century we didnt know about special relativity thats a lot in a relatively short time depending on how you think of time i think it would be premature to say we know limitations
157,lex fridman, at various points throughout the history we thought we solved everything or at least various people declared
158,lisa randall, inaudible  various people exactly
159,lex fridman, declared that weve solved everything this also a good place to maybe could you describe the difference between topdown and bottomup approaches to theoretical physics that you talked about in the book
160,lisa randall, you could try to jump in and say i have a theory that i think is so perfect that i can predict everything from it or at least predict some salient features from it
161,lex fridman, mmhmm thats topdown
162,lisa randall, that would be a topdown bottomup is more like the questions we just asked why are masses what they are we measure things we want to put them together usually a good approach is to combine the two if you ask a very specific question but combine it with the methods of knowing that there could be a fundamental theory underlying it sometimes you make progress
163,lisa randall, the community tends to get segmented or fragmented into people who do one or the other but there are definitely times some of my best collaborations with people who are more topdown than i am so that we come up with interesting ideas that we wouldnt have thought of if either one of us was working individually
164,lex fridman, would you say the truly big leaps happened topdown like einstein
165,lisa randall, einstein was not a topdown person in the beginning special relativity was very much him thinking about they were thought experiments but he was very much the original theory about relativity is something like on the nature of electromagnetism he was trying to understand how maxwells laws could make sense when they seemed to have different symmetries than what we had thought they were
166,lisa randall, he was very much a bottomup person and in fact he resisted topdown for a long time then when he tried to do the theory of general relativity or the general theory of relativity whichever you want to call it incorporating gravity into the system when you need some feedback then he was helped by a mathematician who had developed some differential geometry and helped him figure out how to write down that
167,lisa randall, after that he thought topdown was the way to go but he actually didnt make that much progress i think its naive to think it was just one or the other in fact a lot of people who made real progress were rooted in actual measurements
168,lisa randall,physics vs mathematics
169,lex fridman, speaking of mathematicians what do you is the difference youve had a bit of foot in both between physics and mathematics in the way it helps us understand the world
170,lisa randall, to be frank theres a lot more overlap in physics and math i think that has been maybe not more but theres certainly a lot i think again the kinds of questions youre asking are usually different mathematicians like the structure itself physicists are trying to concentrate on to some extent on the consequences for the world but there is a lot of overlap
171,lex fridman, the string theory is an example theres certain theories where theres a certain mathematical beauty to it
172,lisa randall, theres also some really cool ideas that you get in particle physics where you can describe whats going on and connect it to other ideas thats also really beautiful i think basically insights can be beautiful they might seem simple and sometimes they genuinely are and sometimes theyre built on a whole system that you have to understand before if you actually saw einsteins equations written out in components if you wouldnt think its so beautiful if you write in a compact way it looks nice
173,lex fridman, what do you think about the successes and the failures of string theory to what degree do you think it succeeded to what degrees it not succeeded yet or has failed
174,lisa randall, i think to talk about any science in terms of success and failure often misses the point because theres not some absolute thing i do think that string theorists were a bit overly ambitious not overly ambitious but a little bit overly arrogant in the beginning thinking they could solve many problems that they werent going to solve
175,lisa randall, thats not to say the methods and advances in strength theory dont exist but they certainly werent able to immediately solve all the problems they thought they could solve it has given us tools it has given us some insights but it becomes almost a sociological question of how much it should be one or the other
176,lisa randall, i do think that you can get caught up in the problems themselves and sometimes you can get caught up in the methods and just do other examples the real physics insights often come from people who are thinking about physics as well as math
177,lex fridman, because you mentioned ai is there hope that ai might be able to help find some interesting insights another way to ask this question is how special are humans that were able to discover novel insights about the world
178,lisa randall, thats a great question and it depends on what kind of insights and what were going to find that out because its hard to think about something that doesnt quite exist yet i could just think about something take a step back its a little bit like im trying understand four dimensions so you go back to three dimensions go to something you can imagine
179,lisa randall, you can say a lot of the things in a very different level about the internet you could say has the internet helped do things it definitely took on a life of its own in some sense but its also something that were able to tame i know that i myself wouldnt have been able to write books if the internet didnt exist because i wouldnt have had the time to go to the library and look everything up it helped me enormously
180,lisa randall, in some sense ai could be that in a very nice world it could be a tool that helps us go a step further than we would and a lot more efficiently its already done that to some extent or it could be like the parts of the internet that we can control that are ruining politics or whatever theres certainly a lot of indications that can do that then there are even bigger things that people speculate about ai being able to do its own things but in terms of actually figuring things out were in the early stages
181,lex fridman, yeah theres several directions here one is on the theorem prover side wolfram alpha where everythings much more precise and we have large language model type of stuff one of the limitations of those is it seems to come up with convincing looking things which we dont know if its true or not and thats a big problem for physics
182,lisa randall, large language models are more or less generalizations of stuff that we have theres still breakthroughs in ai waiting to happen and maybe they are happening and maybe theyll be good maybe not but thats not quite the same maybe in some cases its just pattern recognition that leads to important things but sometimes it could be something more insightful than that that i cant even put my finger on
183,lisa randall, it forces us to we dont really understand how smart we are we dont understand how we think about things all that well actually but one thing is true though we are a lot more efficient right now than computers and coming up with things we require a lot less energy to do that if computers figure out how to do that then its going to be at a totally different ball game
184,lisa randall, here are clearly kinds of connections that we dont know how were making but we are making them thats going to be interesting i say were in early stages but this is changing very rapidly right now i dont think that its actually discovered new laws of physics but could it in the future maybe it can
185,lex fridman, it will raise big questions about what is special about humans that we dont quite appreciate there could be things that are like that leap of insight that happens truly novel ideas that could potentially be very difficult to do
186,lisa randall, there are abstract questions like that theres also questions of how is it that we can address to some extent how will ai be used in the context of the world we live in which is based on at least our countrys based on capitalism in a certain political system how will global politics deal with it how will our capitalist system deal with it what will be the things that we focus on doing with it how much will researchers get control of it to be able to ask different sorts of questions
187,lisa randall, while it was starting out people were doing these kinds of toy problems but what will it actually be applied to and what will it be optimized to do theres a lot of questions out there that its really important we start addressing
